NAME	FEATURE CLASS	DESCRIPTION	PHONE NUMBER	E-MAIL ADDRESS	WEB ADDRESS	LONGITUDE	LATITUDE	USER
Zamek Bechyne, Zamek 1, VI,IX ct-ne 10-15, VII-VIII ut-ne 10-15, vstupenky v infocentru+420603419590	USER_POI_PRIVATE	Zamek Bechyne, Zamek 1, VI,IX ct-ne 10-15, VII-VIII ut-ne 10-15, vstupenky v infocentru+420603419590				144681250	492917580	Host
Zamek Liblice, Liblice 61+420315632111	USER_POI_PRIVATE	Zamek Liblice, Liblice 61+420315632111				145864890	503117480	Host
Zamek Vysoka u Pribrame, Vysoka u Pribrame 69, XII-III ut-pa 10-15, IV-XI ut-ne 10-16+420318618115	USER_POI_PRIVATE	Zamek Vysoka u Pribrame, Vysoka u Pribrame 69, XII-III ut-pa 10-15, IV-XI ut-ne 10-16+420318618115				139401250	496368800	Host
Zamek Vojnice, Volenice-Vojnice 1, nepristupnonenalezeno	USER_POI_PRIVATE	Zamek Vojnice, Volenice-Vojnice 1, nepristupnonenalezeno				137061580	492252720	Host
Zamek Humprecht, Sobotka+420493571583	USER_POI_PRIVATE	Zamek Humprecht, Sobotka+420493571583				151697940	504702140	Host
Zamek Veltrusy, Veltrusy-Ostrov 59, ut-pa 10-16:30, so-ne 10-17+420315781146	USER_POI_PRIVATE	Zamek Veltrusy, Veltrusy-Ostrov 59, ut-pa 10-16:30, so-ne 10-17+420315781146				143298460	502776040	Host
zamek Mikulov, Mikulov okr.Breclav, zamek stoji na miste puvodniho hradu ze zacatku 13. stoleti. Pozdeji byl prestaven na renesancni zamek, po pozaru v r. 1719 byl upraven barokne. Na konci 2. svetove valky byl vypalen nemeckymi vojsky. K nejzajimavejsim castem zamku patri zamecka knihovna a sal predku. Nyni prostory zamku vyuziva Regionalni muzeum v Mikulove nebo jsou vyuzivany k poradani kulturnich a spolecenskych akci, jakym je kazdorocni vinobrani.+420519309014	USER_POI_PRIVATE	zamek Mikulov, Mikulov okr.Breclav, zamek stoji na miste puvodniho hradu ze zacatku 13. stoleti. Pozdeji byl prestaven na renesancni zamek, po pozaru v r. 1719 byl upraven barokne. Na konci 2. svetove valky byl vypalen nemeckymi vojsky. K nejzajimavejsim castem zamku patri zamecka knihovna a sal predku. Nyni prostory zamku vyuziva Regionalni muzeum v Mikulove nebo jsou vyuzivany k poradani kulturnich a spolecenskych akci, jakym je kazdorocni vinobrani.+420519309014				166366950	488066680	Host
Zamek Chocenice, Brezany I-Chocenice 44, Byv.zamek a zamecka kaplenenalezeno	USER_POI_PRIVATE	Zamek Chocenice, Brezany I-Chocenice 44, Byv.zamek a zamecka kaplenenalezeno				150958010	500294510	Host
Zamek Roztez, Vidice-Roztez 1, nepristupnonenalezeno	USER_POI_PRIVATE	Zamek Roztez, Vidice-Roztez 1, nepristupnonenalezeno				151893240	499047550	Host
Zamek Soutice, Soutice 1, nepristupnonenalezeno	USER_POI_PRIVATE	Zamek Soutice, Soutice 1, nepristupnonenalezeno				150545380	497281900	Host
Villaniho zamek Strizkov u Brenovic, Struharov-Strizkov, chatrajici nepristupnonenalezeno	USER_POI_PRIVATE	Villaniho zamek Strizkov u Brenovic, Struharov-Strizkov, chatrajici nepristupnonenalezeno				147763980	497875290	Host
Zamek Sazava (puvodne klaster), Zamecka 72, ut-ne 10-17 (duben a rijen pouze so-ne, cervenec,srpen do 18.45))+420327321177	USER_POI_PRIVATE	Zamek Sazava (puvodne klaster), Zamecka 72, ut-ne 10-17 (duben a rijen pouze so-ne, cervenec,srpen do 18.45))+420327321177				148974660	498774110	Host
Zamek Branna, IV-VI so-ne 9-17, VII-VIII ut-ne 9-17, IX-X so-ne 9-17+420603326508	USER_POI_PRIVATE	Zamek Branna, IV-VI so-ne 9-17, VII-VIII ut-ne 9-17, IX-X so-ne 9-17+420603326508				170116360	501511290	Host
Zamek Klobouky u Brna, namesti Miru 169/1, muzeum+420519361577	USER_POI_PRIVATE	Zamek Klobouky u Brna, namesti Miru 169/1, muzeum+420519361577				168579490	489958890	Host
Lesna, Lesna 1, zamecky park denne, zamek od 15.brezna+420571635239	USER_POI_PRIVATE	Lesna, Lesna 1, zamecky park denne, zamek od 15.brezna+420571635239				179297810	495195620	Host
Zamek Vlcice, Vlcice 1, nepristupnonenalezeno	USER_POI_PRIVATE	Zamek Vlcice, Vlcice 1, nepristupnonenalezeno				158226200	505598540	Host
Zamek Vodice u Tabora, Vodice 1, nepristupnonenalezeno	USER_POI_PRIVATE	Zamek Vodice u Tabora, Vodice 1, nepristupnonenalezeno				149088740	494647280	Host
Zamek Knezice, Knezice 1, pristupno prilezitostnenenalezeno	USER_POI_PRIVATE	Zamek Knezice, Knezice 1, pristupno prilezitostnenenalezeno				156715660	492662970	Host
Zamek Panenske Brezany - dolni zamek, Hlavni 50, nepristupno, Vystavba zamku zacala kolem roku 1840. Je to obdelny patrovy objekt se strednim rizalitem v empirovem slohu.  Za protektoratu byl zamek sidlem risskeho protektora Konstantina von Neuratha, pozdeji ho roku 1941 vystridal Reinhard Heydrich.  Po skonceni 2. svetove valky byl zamek zestatnen a sidlil v nem Vyzkumny ustav kovu. V soucasnosti neni verejnosti pristupny.nenalezeno	USER_POI_PRIVATE	Zamek Panenske Brezany - dolni zamek, Hlavni 50, nepristupno, Vystavba zamku zacala kolem roku 1840. Je to obdelny patrovy objekt se strednim rizalitem v empirovem slohu.  Za protektoratu byl zamek sidlem risskeho protektora Konstantina von Neuratha, pozdeji ho roku 1941 vystridal Reinhard Heydrich.  Po skonceni 2. svetove valky byl zamek zestatnen a sidlil v nem Vyzkumny ustav kovu. V soucasnosti neni verejnosti pristupny.nenalezeno				144424350	502160950	Host
Zamek Panenske Brezany - horni zamek, Hlavni 11, Zamek byl postaven v prvni polovine 18. stoleti v baroknim slohu. Slouzil jako rezidence abatysi benediktinskeho klastera sv. Jiri na Prazskem hrade.  Po zruseni radu se zamek stal soucasti soukromeho majetku Augusta Ledebour-Wichelna. Pozdeji nekolikrat zmenil majitele az jej od roku 1938 vyuzival K. H. Frank. Po skonceni 2. svetove valky slouzil jako domov pro seniorynenalezeno	USER_POI_PRIVATE	Zamek Panenske Brezany - horni zamek, Hlavni 11, Zamek byl postaven v prvni polovine 18. stoleti v baroknim slohu. Slouzil jako rezidence abatysi benediktinskeho klastera sv. Jiri na Prazskem hrade.  Po zruseni radu se zamek stal soucasti soukromeho majetku Augusta Ledebour-Wichelna. Pozdeji nekolikrat zmenil majitele az jej od roku 1938 vyuzival K. H. Frank. Po skonceni 2. svetove valky slouzil jako domov pro seniorynenalezeno				144371030	502129190	Host
Zamek Dolni Brezany, 5. kvetna 1, nepristupny, Renesancni dvoupatrova ctyrkridla budova se rozklada na ctvercovem pudorysu s uzavrenym dvorem a hranolovou vezi v zapadnim pruceli. K severnimu kridlu tesne prileha obdelna polokruhovita kaple sv. Mari Magdaleny z konce 19. stoleti. Na zamek z jizni strany navazuje park a budovy hospodarskeho dvora. Soucasna podoba sidla je dana posledni inovaci na prelomu 19. a 20. stoleti.nenalezeno	USER_POI_PRIVATE	Zamek Dolni Brezany, 5. kvetna 1, nepristupny, Renesancni dvoupatrova ctyrkridla budova se rozklada na ctvercovem pudorysu s uzavrenym dvorem a hranolovou vezi v zapadnim pruceli. K severnimu kridlu tesne prileha obdelna polokruhovita kaple sv. Mari Magdaleny z konce 19. stoleti. Na zamek z jizni strany navazuje park a budovy hospodarskeho dvora. Soucasna podoba sidla je dana posledni inovaci na prelomu 19. a 20. stoleti.nenalezeno				144570600	499625400	Host
Zamek Zirovnice, Branka 1, ut-ne 9-17+420565494095	USER_POI_PRIVATE	Zamek Zirovnice, Branka 1, ut-ne 9-17+420565494095				151837130	492516810	Host
Zamek Vlastejovice, Vlastejovice 1, nepristupnonenalezeno	USER_POI_PRIVATE	Zamek Vlastejovice, Vlastejovice 1, nepristupnonenalezeno				151746950	497312580	Host
Zamek Cerveny Ujezdec, Vlastec-Cerveny Ujezdec, pristupno prilezitostne+420382284288	USER_POI_PRIVATE	Zamek Cerveny Ujezdec, Vlastec-Cerveny Ujezdec, pristupno prilezitostne+420382284288				142226230	493748060	Host
Zamek Velky Tynec, Zamecka 35, (restaurace a obecni urad)nenalezeno	USER_POI_PRIVATE	Zamek Velky Tynec, Zamecka 35, (restaurace a obecni urad)nenalezeno				173326560	495497330	Host
Zamek Stare Hrady, Stare Hrady 1, X-IV so-ne 10-17, V-IX ut-ne 9:30-17+420602302265	USER_POI_PRIVATE	Zamek Stare Hrady, Stare Hrady 1, X-IV so-ne 10-17, V-IX ut-ne 9:30-17+420602302265				152137040	503863490	Host
Zamek Peruc, namesti E. Filly 1, nepristupnonenalezeno	USER_POI_PRIVATE	Zamek Peruc, namesti E. Filly 1, nepristupnonenalezeno				139628460	503435930	Host
Zamek Vlasatice, nepristupnonenalezeno	USER_POI_PRIVATE	Zamek Vlasatice, nepristupnonenalezeno				164782280	489338270	Host
Zamek Alfredov, Kostelec u Stribra, nepristupno - hotelnenalezeno	USER_POI_PRIVATE	Zamek Alfredov, Kostelec u Stribra, nepristupno - hotelnenalezeno				130317820	496850690	Host
Zamek Vimperk, Zamek 20, IV,X so-ne 10-16, V-IX ut-pa 10-16, so-ne 9-17:30+420388411506	USER_POI_PRIVATE	Zamek Vimperk, Zamek 20, IV,X so-ne 10-16, V-IX ut-pa 10-16, so-ne 9-17:30+420388411506				137722010	490544740	Host
Zamek Vilemovice, Vilemovice 1, nepristupnonenalezeno	USER_POI_PRIVATE	Zamek Vilemovice, Vilemovice 1, nepristupnonenalezeno				153221580	496877260	Host
Zamek Vilemov u Kadane, Namesti 118, nepristupnonenalezeno	USER_POI_PRIVATE	Zamek Vilemov u Kadane, Namesti 118, nepristupnonenalezeno				133129200	503002430	Host
Zamek Lemberk, Jablonne v Podjestedi - Lvova 1, IV,X so-ne 9-15, V-IX ut-ne 9-16+420487762305	USER_POI_PRIVATE	Zamek Lemberk, Jablonne v Podjestedi - Lvova 1, IV,X so-ne 9-15, V-IX ut-ne 9-16+420487762305				147879190	507772950	Host
Zamek Priseka, Priseka 18, muzeum modelu auticeknenalezeno	USER_POI_PRIVATE	Zamek Priseka, Priseka 18, muzeum modelu auticeknenalezeno				156467470	493389930	Host
Zamek Navarov, Navarov 1, Hrad Navarov byl v roce 1644 na prikaz prazskeho mistodrziciho poboren a jeho zdivo nasledne pouzito na vystavbu zamku. Ten nechala v letech 1664–1666 v duchu baroka vystavet Marie Angela Nounkelova. Jiz kratce po vystavbe vsak pripominal spise urednicky dum. Soucasti zamku byvala take kaple Nanebevstoupeni Pane. V roce 1775 za hrabete Ehrenburka utrpel zamek pri vzpoure sedlaku znacne skody, byl vsak opraven, stejne jako po pozaru v roce 1827. Dalsi upravou prosel v roce 1895 a v roce 1925 necitlivou prestavbou. Od 60. let 20. stoleti slouzil jako rekreacni stredisko, v 90. letech byl prestaven na penzion.nenalezeno	USER_POI_PRIVATE	Zamek Navarov, Navarov 1, Hrad Navarov byl v roce 1644 na prikaz prazskeho mistodrziciho poboren a jeho zdivo nasledne pouzito na vystavbu zamku. Ten nechala v letech 1664–1666 v duchu baroka vystavet Marie Angela Nounkelova. Jiz kratce po vystavbe vsak pripominal spise urednicky dum. Soucasti zamku byvala take kaple Nanebevstoupeni Pane. V roce 1775 za hrabete Ehrenburka utrpel zamek pri vzpoure sedlaku znacne skody, byl vsak opraven, stejne jako po pozaru v roce 1827. Dalsi upravou prosel v roce 1895 a v roce 1925 necitlivou prestavbou. Od 60. let 20. stoleti slouzil jako rekreacni stredisko, v 90. letech byl prestaven na penzion.nenalezeno				153212210	506799770	Host
Zamek Vetrny Jenikov, Vetrny Jenikov 5, nepristupnonenalezeno	USER_POI_PRIVATE	Zamek Vetrny Jenikov, Vetrny Jenikov 5, nepristupnonenalezeno				154784330	494756870	Host
Zamek Veseli nad Moravou, Zamecka 14, nepristupnonenalezeno	USER_POI_PRIVATE	Zamek Veseli nad Moravou, Zamecka 14, nepristupnonenalezeno				173764070	489535780	Host
Zamek Veseli, Janovice nad Uhlavou-Veseli, Nadrazni 2, nepristupnonenalezeno	USER_POI_PRIVATE	Zamek Veseli, Janovice nad Uhlavou-Veseli, Nadrazni 2, nepristupnonenalezeno				132057030	493493490	Host
Zamek Lnare, Lnare 1+420383392521	USER_POI_PRIVATE	Zamek Lnare, Lnare 1+420383392521				137870270	494572210	Host
Zamek Tetetice, Bezdekov-Tetetice 1, nepristupnonenalezeno	USER_POI_PRIVATE	Zamek Tetetice, Bezdekov-Tetetice 1, nepristupnonenalezeno				131989350	494048570	Host
Zamek Kunin, Kunin 1, IV,X so-ne 9-16, V-IX ut-ne 9-17+420556749420	USER_POI_PRIVATE	Zamek Kunin, Kunin 1, IV,X so-ne 9-16, V-IX ut-ne 9-17+420556749420				179901210	496426470	Host
Zamek Klasterec nad Ohri, Chomutovska 1, denne 9-17+420474375436	USER_POI_PRIVATE	Zamek Klasterec nad Ohri, Chomutovska 1, denne 9-17+420474375436				131736460	503841660	Host
Zamek Chudenice, U Cerninskeho zamku 1, IV,V,IX,X so-ne 9-16, VI-VIII ut-ne 9-17 +420376398100	USER_POI_PRIVATE	Zamek Chudenice, U Cerninskeho zamku 1, IV,V,IX,X so-ne 9-16, VI-VIII ut-ne 9-17 +420376398100				131740570	494682850	Host
Zamek Velke Mezirici, Zamecke schody 1200, muzeum, V-X ut-ne 9-12,13-16+420566522773	USER_POI_PRIVATE	Zamek Velke Mezirici, Zamecke schody 1200, muzeum, V-X ut-ne 9-12,13-16+420566522773				160123330	493577450	Host
Zamek Velke Opatovice, Zamek, muzeum+420516477487	USER_POI_PRIVATE	Zamek Velke Opatovice, Zamek, muzeum+420516477487				166685880	496102020	Host
Zamek Kvasiny, Kvasiny 1, nepristupnonenalezeno	USER_POI_PRIVATE	Zamek Kvasiny, Kvasiny 1, nepristupnonenalezeno				162505130	502069020	Host
Zamek Velke Losiny, Zamecka 268, IV,X so-ne 9-16, V-IX ut-ne 9-17+420583248380	USER_POI_PRIVATE	Zamek Velke Losiny, Zamecka 268, IV,X so-ne 9-16, V-IX ut-ne 9-17+420583248380				170315940	500232140	Host
Zamek Frystat, Karvina-Frystat, Masarykovo namesti 1/1, ut-ne 10-17, XI-III so-ne 11-13+420596318382	USER_POI_PRIVATE	Zamek Frystat, Karvina-Frystat, Masarykovo namesti 1/1, ut-ne 10-17, XI-III so-ne 11-13+420596318382				185410190	498534690	Host
Zamek Velke Heraltice, nepristupnonenalezeno	USER_POI_PRIVATE	Zamek Velke Heraltice, nepristupnonenalezeno				177368900	499752200	Host
Zamek Tovacov, Cimburkova 2, IV,V,IX,X so-ne 10-17, VI,VII,VIII ut-ne 10-18+420723334794	USER_POI_PRIVATE	Zamek Tovacov, Cimburkova 2, IV,V,IX,X so-ne 10-17, VI,VII,VIII ut-ne 10-18+420723334794				172913900	494301790	Host
Zamek Namest na Hane Horni zamek, Hrad 1, IV,X so-ne 9-16, V-IX ut-ne 9-17+420585952184	USER_POI_PRIVATE	Zamek Namest na Hane Horni zamek, Hrad 1, IV,X so-ne 9-16, V-IX ut-ne 9-17+420585952184				170630790	495985570	Host
Zamek Lipnik nad Becvou, Bratrska 358/3+420581773763	USER_POI_PRIVATE	Zamek Lipnik nad Becvou, Bratrska 358/3+420581773763				175810210	495250260	Host
Zamek Blansko, Zamek 1/1+420516417221	USER_POI_PRIVATE	Zamek Blansko, Zamek 1/1+420516417221				166459950	493637410	Host
Zamek Blatna, Na Prikopech 375, IV,X so-ne 10-16, VI-IX ut-ne 10-16+420383422934	USER_POI_PRIVATE	Zamek Blatna, Na Prikopech 375, IV,X so-ne 10-16, VI-IX ut-ne 10-16+420383422934				138798350	494226860	Host
Zamek Brandys nad Orlici, Komenskeho 1, nepristupnonenalezeno	USER_POI_PRIVATE	Zamek Brandys nad Orlici, Komenskeho 1, nepristupnonenalezeno				162891010	499997710	Host
Zamek Sec, Chrudimska 1, pristupno prilezitostnenenalezeno	USER_POI_PRIVATE	Zamek Sec, Chrudimska 1, pristupno prilezitostnenenalezeno				156602600	498473620	Host
Zamek Kinskych Valasske Mezirici, Zamecka 3, muzeum, ut-ne 9-17+420571611764	USER_POI_PRIVATE	Zamek Kinskych Valasske Mezirici, Zamecka 3, muzeum, ut-ne 9-17+420571611764				179683650	494784480	Host
Zamek Zerotinu, Valasske Mezirici, Komenskeho 169/4a, pristupno prilezitostnenenalezeno	USER_POI_PRIVATE	Zamek Zerotinu, Valasske Mezirici, Komenskeho 169/4a, pristupno prilezitostnenenalezeno				179692710	494714460	Host
Zamek Zdechovice, Zdechovice 1, nepristupnonenalezeno	USER_POI_PRIVATE	Zamek Zdechovice, Zdechovice 1, nepristupnonenalezeno				154693750	500137450	Host
Zamek Chlum u Trebone, Chlum u Trebone 1, nepristupnonenalezeno	USER_POI_PRIVATE	Zamek Chlum u Trebone, Chlum u Trebone 1, nepristupnonenalezeno				149319950	489602830	Host
Zamek Trebon, Zamek 115, IV,V,IX,X ut-ne 9-16, VI-VIII ut-ne 9-17+420384721193	USER_POI_PRIVATE	Zamek Trebon, Zamek 115, IV,V,IX,X ut-ne 9-16, VI-VIII ut-ne 9-17+420384721193				147694770	490030420	Host
Zamek Telc, namesti Zachariase z Hradce 1, IV,X ut-ne 10-15,V,IX ut-ne 10-16, VI ut-ne 9-16, VII,VIII ut-ne 9-17+420724343244	USER_POI_PRIVATE	Zamek Telc, namesti Zachariase z Hradce 1, IV,X ut-ne 10-15,V,IX ut-ne 10-16, VI ut-ne 9-16, VII,VIII ut-ne 9-17+420724343244				154512790	491853050	Host
Zamek Dobris, namesti Svobody 1, denne 8-16:30, leto 8-17:30+420318521240	USER_POI_PRIVATE	Zamek Dobris, namesti Svobody 1, denne 8-16:30, leto 8-17:30+420318521240				141788640	497818450	Host
Zamek Karlova Koruna, Chlumec nad Cidlinou, Prazska 1, IV-VI,IX,X so-ne 9-12,13-16, VII-VIII ut-ne 9-12,13-17+420495484519	USER_POI_PRIVATE	Zamek Karlova Koruna, Chlumec nad Cidlinou, Prazska 1, IV-VI,IX,X so-ne 9-12,13-16, VII-VIII ut-ne 9-12,13-17+420495484519				154513440	501588890	Host
Zamek Manetin, Manetin 1, IV,X  so-ne 10-16, V-IX ut-ne 10-16+420606666429	USER_POI_PRIVATE	Zamek Manetin, Manetin 1, IV,X  so-ne 10-16, V-IX ut-ne 10-16+420606666429				132324100	499914660	Host
Zamek Zakupy, Borska 1, IV,X so,ne 9-15, V-IX ut-ne 9-16+420487857278	USER_POI_PRIVATE	Zamek Zakupy, Borska 1, IV,X so,ne 9-15, V-IX ut-ne 9-16+420487857278				146436380	506872800	Host
Zamek Vizovice, Palackeho Namesti 376, IV-X so pouze 13-16, IV ne 10-16, V-VI ut-ne 10-17, VII,VIII ut-ne 10-17, IX ut-ne 10-16, X ne 10-16 - viz web+420420722611972	USER_POI_PRIVATE	Zamek Vizovice, Palackeho Namesti 376, IV-X so pouze 13-16, IV ne 10-16, V-VI ut-ne 10-17, VII,VIII ut-ne 10-17, IX ut-ne 10-16, X ne 10-16 - viz web+420420722611972				178504730	492197040	Host
Zamek Lany, Zamecka 2, nepristupnonenalezeno	USER_POI_PRIVATE	Zamek Lany, Zamecka 2, nepristupnonenalezeno				139562620	501238730	Host
Zamek Uhercice u Znojma, Uhercice 1, VI so-ne 9:30-17, VII-VIII ut-ne 9:30-17+420515298396	USER_POI_PRIVATE	Zamek Uhercice u Znojma, Uhercice 1, VI so-ne 9:30-17, VII-VIII ut-ne 9:30-17+420515298396				156334110	489145020	Host
Zamek Krasny Dvur, Krasny Dvur 1, IV so-ne 10-16, V, IX ut-ne 10-16, VI-VIII ut-ne 10-17, X so-ne 10-15+420415210004	USER_POI_PRIVATE	Zamek Krasny Dvur, Krasny Dvur 1, IV so-ne 10-16, V, IX ut-ne 10-16, VI-VIII ut-ne 10-17, X so-ne 10-15+420415210004				133704160	502515110	Host
Zamek Libochovice, namesti 5. kvetna 1, IV ut-ne 10-16, V, VI, IX ut-ne 9-17, VII-VII ut-ne 9-18, X so-ne 10-16+420416591443	USER_POI_PRIVATE	Zamek Libochovice, namesti 5. kvetna 1, IV ut-ne 10-16, V, VI, IX ut-ne 9-17, VII-VII ut-ne 9-18, X so-ne 10-16+420416591443				140436920	504052640	Host
Zamek Mnisek pod Brdy, namesti F. X. Svobody 1, ut-ne dle webu, VII-VII denne 10-15:50+420318590261	USER_POI_PRIVATE	Zamek Mnisek pod Brdy, namesti F. X. Svobody 1, ut-ne dle webu, VII-VII denne 10-15:50+420318590261				142582940	498681070	Host
Zamek Namest nad Oslavou, Namest nad Oslavou, Zamek 1, IV,X so-ne 9-15, V,VI,IX ut-ne 9-16, VII,VIII ut-ne 9-17+420568620201	USER_POI_PRIVATE	Zamek Namest nad Oslavou, Namest nad Oslavou, Zamek 1, IV,X so-ne 9-15, V,VI,IX ut-ne 9-16, VII,VIII ut-ne 9-17+420568620201				161628300	492087650	Host
Zamek Nebilovy, Nebilovy 1, IV,X so-ne 9-15, V,VI,IX ut-ne 9-16, VII,VIII ut-ne 9-17+420377917090	USER_POI_PRIVATE	Zamek Nebilovy, Nebilovy 1, IV,X so-ne 9-15, V,VI,IX ut-ne 9-16, VII,VIII ut-ne 9-17+420377917090				134307250	496299660	Host
Zamek Hruby Rohozec, Hruby Rohozec 1, IV,X ut-pa 10-15, so-ne 9-16, V-IX 9-17+420725181569	USER_POI_PRIVATE	Zamek Hruby Rohozec, Hruby Rohozec 1, IV,X ut-pa 10-15, so-ne 9-16, V-IX 9-17+420725181569				151573870	505982710	Host
Zamek Votice(novy), Nerudova 2nenalezeno	USER_POI_PRIVATE	Zamek Votice(novy), Nerudova 2nenalezeno				146418250	496373570	Host
Zamek Novy Hrad-Jimlin, Jimlin 220, IV,X po-pa 10-15; so-ne 9-16; V,IX denne 10-17; VI-VIII denne 9-17+420415696216	USER_POI_PRIVATE	Zamek Novy Hrad-Jimlin, Jimlin 220, IV,X po-pa 10-15; so-ne 9-16; V,IX denne 10-17; VI-VIII denne 9-17+420415696216				137503020	503195870	Host
Zamek Kostelec nad Orlici(novy), Komenskeho 1, (kveten,cerven,zari: so-ne 9-17)(cervenec,srpen: ut-ne 9-17)+420494323271	USER_POI_PRIVATE	Zamek Kostelec nad Orlici(novy), Komenskeho 1, (kveten,cerven,zari: so-ne 9-17)(cervenec,srpen: ut-ne 9-17)+420494323271				161997650	501226280	Host
Zamek Novy Stranov, Jizerni Vtelno 83, (VI-IX) ut-pa 10-16, (III-IX so-ne 10-17)+420731005123	USER_POI_PRIVATE	Zamek Novy Stranov, Jizerni Vtelno 83, (VI-IX) ut-pa 10-16, (III-IX so-ne 10-17)+420731005123				148558220	503726650	Host
Zamek Skvorec(novy), Smirickych 2, nepristupnonenalezeno	USER_POI_PRIVATE	Zamek Skvorec(novy), Smirickych 2, nepristupnonenalezeno				147347470	500458960	Host
Zamek Ratbor(novy), Komenskeho 40, hotel a restauracenenalezeno	USER_POI_PRIVATE	Zamek Ratbor(novy), Komenskeho 40, hotel a restauracenenalezeno				151544110	499773320	Host
Zamek Horovice(novy), Vrbnovska 22/2, IV,X so-ne 10-16, V,IX ut-ne 10-16, VI-VII 10-17+420311512479	USER_POI_PRIVATE	Zamek Horovice(novy), Vrbnovska 22/2, IV,X so-ne 10-16, V,IX ut-ne 10-16, VI-VII 10-17+420311512479				139087820	498376280	Host
Zamek Horovice(stary), Vrbnovska 27/5nenalezeno	USER_POI_PRIVATE	Zamek Horovice(stary), Vrbnovska 27/5nenalezeno				139066670	498382280	Host
Zamek Dacice(stary), Krajirova 27, mestsky urad+420384401211	USER_POI_PRIVATE	Zamek Dacice(stary), Krajirova 27, mestsky urad+420384401211				154376490	490807450	Host
Zamek Dacice(novy), Havlickovo namesti 85/I, IV,X so-ne 10-16, V,IX ut-ne 10-17, VI-VIII ut-ne 10-18+420384420246	USER_POI_PRIVATE	Zamek Dacice(novy), Havlickovo namesti 85/I, IV,X so-ne 10-16, V,IX ut-ne 10-17, VI-VIII ut-ne 10-18+420384420246				154316520	490795880	Host
Zamek Sychrov, Sychrov 1, denne 10-14, V-VIII denne 9-16:30+420482416011	USER_POI_PRIVATE	Zamek Sychrov, Sychrov 1, denne 10-14, V-VIII denne 9-16:30+420482416011				150889380	506262640	Host
Zamek Zvikovec, Zvikovec 1, nepristupno - Ustav socialni pecenenalezeno	USER_POI_PRIVATE	Zamek Zvikovec, Zvikovec 1, nepristupno - Ustav socialni pecenenalezeno				136891350	499551050	Host
Zamecky statek Ujezd nade Mzi, Ujezd nade Mzi 1+420724396671	USER_POI_PRIVATE	Zamecky statek Ujezd nade Mzi, Ujezd nade Mzi 1+420724396671				131950220	497883120	Host
Zamek Hlucin, Zamecka 286/4, tvrz prestavena na zamek, muzeum+420595041337	USER_POI_PRIVATE	Zamek Hlucin, Zamecka 286/4, tvrz prestavena na zamek, muzeum+420595041337				181854830	498963550	Host
Zamek Duchcov, Namesti Republiky 202/9, IV,X so-ne 10-16, V,IX ut-ne 10-16, VI-VIII ut-ne 10-17+420417835301	USER_POI_PRIVATE	Zamek Duchcov, Namesti Republiky 202/9, IV,X so-ne 10-16, V,IX ut-ne 10-16, VI-VIII ut-ne 10-17+420417835301				137446470	506022240	Host
Zamek Bucovice, Zamek 1, IV,X so-ne 9-15, V,VI,IX ut-ne 9-16, VII,VIII ut-ne 9-17+420517383135	USER_POI_PRIVATE	Zamek Bucovice, Zamek 1, IV,X so-ne 9-15, V,VI,IX ut-ne 9-16, VII,VIII ut-ne 9-17+420517383135				170014710	491493530	Host
Zamek Dolni Benesov, Hajecka 65, (nepristupno) - obecni uradnenalezeno	USER_POI_PRIVATE	Zamek Dolni Benesov, Hajecka 65, (nepristupno) - obecni uradnenalezeno				181154760	499167180	Host
Zamek Benesov nad Ploucnici, Zamecka 51, IV, X so,ne 10-16, V 10-17, VI-VIII 10-18, IX 10-17+420412586575	USER_POI_PRIVATE	Zamek Benesov nad Ploucnici, Zamecka 51, IV, X so,ne 10-16, V 10-17, VI-VIII 10-18, IX 10-17+420412586575				143111440	507424390	Host
Zamek Rajec nad Svitavou, Rajec-Jestrebi, Blanenska 1, IV,X so-ne 9-15, V-IX ut-ne 9-16+420723398968	USER_POI_PRIVATE	Zamek Rajec nad Svitavou, Rajec-Jestrebi, Blanenska 1, IV,X so-ne 9-15, V-IX ut-ne 9-16+420723398968				166439830	494093570	Host
Zamek Jansky Vrch, Javornik, Zamek 60, IV.,X. so,ne,sv 9-15, V.-VIII. ut-ne 9-16, IX. ut-ne 9-15+420584440286	USER_POI_PRIVATE	Zamek Jansky Vrch, Javornik, Zamek 60, IV.,X. so,ne,sv 9-15, V.-VIII. ut-ne 9-16, IX. ut-ne 9-15+420584440286				170001420	503897780	Host
Zamek Slatinany, Zamecky park 1, IV.,X. so,ne,sv 10-15, V.,IX. ut-pa 10-15, so,ne 10-16, VI. ut-ne 10-16, VII.,VIII. ut-ne 10-17+420724663680	USER_POI_PRIVATE	Zamek Slatinany, Zamecky park 1, IV.,X. so,ne,sv 10-15, V.,IX. ut-pa 10-15, so,ne 10-16, VI. ut-ne 10-16, VII.,VIII. ut-ne 10-17+420724663680				158109290	499191620	Host
Zamek Dolni Prim, Dolni Prim 1, nepristupny - obecni uradnenalezeno	USER_POI_PRIVATE	Zamek Dolni Prim, Dolni Prim 1, nepristupny - obecni uradnenalezeno				157056900	502392790	Host
Zamek Merklin u Prestic, Zamek 1, nepristupny - obecni urad+42037791279	USER_POI_PRIVATE	Zamek Merklin u Prestic, Zamek 1, nepristupny - obecni urad+42037791279				131999700	495603910	Host
Lovecky zamecek Diana, Klasicistni lovecky zamek Diana byl vybudovan na pudorysu rovnoramenneho krize, v interieru jsou malby a fresky Diany, bohyne lovu. Centralni jednoposchodovy pavilon je zastresen kupoli ukoncenou kovovym sedicim jelenem. Na zamek navazuje rozsahly anglicky park s exotickymi jehlicnany, tulipany, duby, cervenymi buky a jirovci.nenalezeno	USER_POI_PRIVATE	Lovecky zamecek Diana, Klasicistni lovecky zamek Diana byl vybudovan na pudorysu rovnoramenneho krize, v interieru jsou malby a fresky Diany, bohyne lovu. Centralni jednoposchodovy pavilon je zastresen kupoli ukoncenou kovovym sedicim jelenem. Na zamek navazuje rozsahly anglicky park s exotickymi jehlicnany, tulipany, duby, cervenymi buky a jirovci.nenalezeno				125958530	496293790	Host
Zamek Belcredi, Brno-Lisen, Pohankova+420544213238	USER_POI_PRIVATE	Zamek Belcredi, Brno-Lisen, Pohankova+420544213238				166971570	492050390	Host
Zamek Ctenice, Praha 9-Vinor, Bohdanecska 259, ut-ne 10-18+420286001366	USER_POI_PRIVATE	Zamek Ctenice, Praha 9-Vinor, Bohdanecska 259, ut-ne 10-18+420286001366				145640140	501493070	Host
Zamek Tyn nad Vltavou, namesti Miru 1, Mestske muzeum+420385772303	USER_POI_PRIVATE	Zamek Tyn nad Vltavou, namesti Miru 1, Mestske muzeum+420385772303				144211630	492237080	Host
Zamek Mikulovice, Mikulovice 141, nepristupny, faranenalezeno	USER_POI_PRIVATE	Zamek Mikulovice, Mikulovice 141, nepristupny, faranenalezeno				160939570	489553270	Host
Zamek Milesov, Velemin-Milesov 1, nepristupnynenalezeno	USER_POI_PRIVATE	Zamek Milesov, Velemin-Milesov 1, nepristupnynenalezeno				139363210	505401030	Host
Zamek Miletin, Na Parkani 1, pristupno prilezitostnenenalezeno	USER_POI_PRIVATE	Zamek Miletin, Na Parkani 1, pristupno prilezitostnenenalezeno				156784340	504046570	Host
Zamek Troja, Praha 7-Troja, U trojskeho zamku 1/4, IV-X ut-ne 10-18+420283851614	USER_POI_PRIVATE	Zamek Troja, Praha 7-Troja, U trojskeho zamku 1/4, IV-X ut-ne 10-18+420283851614				144128560	501164160	Host
